{
  "$schema": "https://json-schema.org/draft/2020-12/schema",
  "$id": "https://orbite.local/schemas/theme-interface-v5.json",
  "title": "Orbite declarative theme interface v5",
  "type": "object",
  "additionalProperties": false,
  "required": ["format", "assets", "slots", "choices", "targets", "selection", "pinning"],
  "properties": {
    "format": { "const": "orbite.theme-interface/5" },
    "assets": {
      "type": "array",
      "minItems": 1,
      "maxItems": 128,
      "items": {
        "type": "object",
        "additionalProperties": false,
        "required": ["id", "path", "sha256"],
        "properties": {
          "id": { "$ref": "#/$defs/id" },
          "path": { "$ref": "#/$defs/relativePath" },
          "sha256": { "$ref": "#/$defs/sha256" }
        }
      }
    },
    "models": {
      "type": "array",
      "maxItems": 64,
      "items": {
        "type": "object",
        "additionalProperties": false,
        "required": ["id", "path", "sha256", "clip_indices"],
        "properties": {
          "id": { "$ref": "#/$defs/id" },
          "path": { "$ref": "#/$defs/relativeGlbPath" },
          "sha256": { "$ref": "#/$defs/sha256" },
          "clip_indices": {
            "type": "array",
            "maxItems": 16,
            "items": { "type": "integer", "minimum": 0, "maximum": 63 }
          },
          "hide_parts": {
            "type": "array",
            "maxItems": 32,
            "uniqueItems": true,
            "items": { "$ref": "#/$defs/id" }
          },
          "part_offsets": {
            "type": "object",
            "maxProperties": 32,
            "propertyNames": { "$ref": "#/$defs/id" },
            "additionalProperties": { "$ref": "#/$defs/vector3" }
          },
          "effect_sockets": {
            "type": "object",
            "maxProperties": 32,
            "propertyNames": { "$ref": "#/$defs/id" },
            "additionalProperties": {
              "type": "array",
              "prefixItems": [
                { "anyOf": [{ "$ref": "#/$defs/vector3" }, { "type": "null" }] },
                { "anyOf": [{ "$ref": "#/$defs/vector3" }, { "type": "null" }] }
              ],
              "items": false,
              "minItems": 2,
              "maxItems": 2
            }
          },
          "footprint": {
            "type": "array",
            "prefixItems": [
              { "type": "number" }, { "type": "number" }, { "type": "number" },
              { "type": "number" }, { "type": "number" }
            ],
            "items": false,
            "minItems": 5,
            "maxItems": 5
          }
        }
      }
    },
    "slots": {
      "type": "object",
      "minProperties": 9,
      "maxProperties": 128,
      "propertyNames": { "$ref": "#/$defs/id" },
      "additionalProperties": { "$ref": "#/$defs/id" }
    },
    "choices": {
      "type": "array",
      "maxItems": 64,
      "items": {
        "type": "object",
        "additionalProperties": false,
        "required": ["id", "label", "kind", "preview"],
        "properties": {
          "id": { "$ref": "#/$defs/id" },
          "label": { "type": "string", "minLength": 1, "maxLength": 80 },
          "kind": { "$ref": "#/$defs/id" },
          "preview": { "$ref": "#/$defs/id" },
          "appearance": {
            "oneOf": [
              { "type": "null" },
              {
                "type": "object",
                "additionalProperties": false,
                "required": ["part"],
                "properties": {
                  "part": { "$ref": "#/$defs/id" },
                  "material": { "$ref": "#/$defs/id" },
                  "tint": {
                    "type": "array",
                    "minItems": 4,
                    "maxItems": 4,
                    "items": { "type": "number", "minimum": 0, "maximum": 2 }
                  },
                  "model": { "$ref": "#/$defs/id" }
                },
                "dependentRequired": { "material": ["tint"], "tint": ["material"] },
                "anyOf": [
                  { "required": ["model"], "properties": { "model": { "$ref": "#/$defs/id" } } },
                  {
                    "required": ["material", "tint"],
                    "properties": {
                      "material": { "$ref": "#/$defs/id" },
                      "tint": {
                        "type": "array",
                        "minItems": 4,
                        "maxItems": 4,
                        "items": { "type": "number", "minimum": 0, "maximum": 2 }
                      }
                    }
                  }
                ]
              }
            ]
          },
          "attributes": {
            "type": "object",
            "maxProperties": 8,
            "propertyNames": { "$ref": "#/$defs/id" },
            "additionalProperties": { "$ref": "#/$defs/id" }
          }
        }
      }
    },
    "targets": {
      "type": "array",
      "maxItems": 16,
      "items": {
        "type": "object",
        "additionalProperties": false,
        "required": ["id", "label"],
        "properties": {
          "id": { "$ref": "#/$defs/id" },
          "label": { "type": "string", "minLength": 1, "maxLength": 80 },
          "session_id": { "type": ["string", "null"], "pattern": "^[a-zA-Z][a-zA-Z0-9._-]{0,95}$" }
        }
      }
    },
    "selection": {
      "type": "object",
      "additionalProperties": false,
      "required": ["stages"],
      "properties": {
        "stages": {
          "type": "array",
          "minItems": 1,
          "maxItems": 8,
          "items": {
            "type": "object",
            "additionalProperties": false,
            "required": ["id", "label", "kind", "columns"],
            "properties": {
              "id": { "$ref": "#/$defs/id" },
              "label": { "type": "string", "minLength": 1, "maxLength": 80 },
              "kind": { "$ref": "#/$defs/id" },
              "columns": { "type": "integer", "minimum": 2, "maximum": 10 }
            }
          }
        },
        "compatibility": {
          "type": "array",
          "maxItems": 16,
          "items": {
            "type": "object",
            "additionalProperties": false,
            "required": ["source_stage", "target_stage", "attribute"],
            "properties": {
              "source_stage": { "$ref": "#/$defs/id" },
              "target_stage": { "$ref": "#/$defs/id" },
              "attribute": { "$ref": "#/$defs/id" }
            }
          }
        }
      }
    },
    "placements": {
      "type": "array",
      "maxItems": 4096,
      "items": {
        "type": "object",
        "additionalProperties": false,
        "required": ["selections", "part", "translation"],
        "properties": {
          "selections": {
            "type": "object",
            "minProperties": 1,
            "maxProperties": 8,
            "propertyNames": { "$ref": "#/$defs/id" },
            "additionalProperties": { "$ref": "#/$defs/id" }
          },
          "part": { "$ref": "#/$defs/id" },
          "translation": { "$ref": "#/$defs/vector3" }
        }
      }
    },
    "pinning": {
      "type": "object",
      "additionalProperties": false,
      "required": ["target_ids", "visibility_scope", "same_instance_and_session", "edit_mode", "controls", "actions", "limits", "persistent_per_object_settings", "atomic_preview"],
      "properties": {
        "target_ids": {
          "type": "array",
          "minItems": 1,
          "maxItems": 16,
          "uniqueItems": true,
          "items": { "$ref": "#/$defs/id" }
        },
        "visibility_scope": { "const": "workspace-windows" },
        "same_instance_and_session": { "const": true },
        "edit_mode": { "const": "transform-frame" },
        "controls": {
          "type": "array",
          "minItems": 4,
          "maxItems": 4,
          "uniqueItems": true,
          "items": { "enum": ["position", "size", "brightness", "opacity"] }
        },
        "actions": {
          "type": "array",
          "minItems": 3,
          "maxItems": 3,
          "uniqueItems": true,
          "items": { "enum": ["accept", "cancel", "disable"] }
        },
        "limits": {
          "type": "object",
          "additionalProperties": false,
          "required": ["size", "brightness", "opacity"],
          "properties": {
            "size": { "$ref": "#/$defs/positiveRange" },
            "brightness": { "$ref": "#/$defs/unitRange" },
            "opacity": { "$ref": "#/$defs/unitRange" }
          }
        },
        "persistent_per_object_settings": { "const": true },
        "atomic_preview": { "const": true }
      }
    }
  },
  "$defs": {
    "id": { "type": "string", "pattern": "^[a-zA-Z][a-zA-Z0-9._-]{0,95}$" },
    "sha256": { "type": "string", "pattern": "^[a-f0-9]{64}$" },
    "relativePath": { "type": "string", "pattern": "^(?!/)(?!.*(?:^|/)\\.\\.(?:/|$))[^\\\\:]{1,240}\\.png$" },
    "relativeGlbPath": { "type": "string", "pattern": "^(?!/)(?!.*(?:^|/)\\.\\.(?:/|$))[^\\\\:]{1,240}\\.glb$" },
    "positiveRange": {
      "type": "array",
      "prefixItems": [{ "type": "number", "exclusiveMinimum": 0 }, { "type": "number", "exclusiveMinimum": 0 }],
      "items": false,
      "minItems": 2,
      "maxItems": 2
    },
    "unitRange": {
      "type": "array",
      "prefixItems": [{ "type": "number", "minimum": 0, "maximum": 1 }, { "type": "number", "minimum": 0, "maximum": 1 }],
      "items": false,
      "minItems": 2,
      "maxItems": 2
    },
    "vector3": {
      "type": "array",
      "prefixItems": [{ "type": "number" }, { "type": "number" }, { "type": "number" }],
      "items": false,
      "minItems": 3,
      "maxItems": 3
    }
  }
}
